<?xml version="1.0"?>
<!DOCTYPE crontab SYSTEM "crontab.dtd">
<crontab>
<crontabentry id="-1">
	<seconds>0</seconds> 
	<minutes>*</minutes> 
	<hours>*</hours> 
	<daysofmonth>*</daysofmonth> 
	<months>*</months> 
	<daysofweek>*</daysofweek> 
	<years>*</years> 
	<bussinesdays>true</bussinesdays> 
	<startDate>null</startDate> 
	<endDate>null</endDate> 
	<class>tests.test</class> 
	<method></method> 
	<parameters>1 2 3</parameters>
	<description>null</description> 
</crontabentry>
<crontabentry id="-1">
	<seconds>0</seconds> 
	<minutes>*</minutes> 
	<hours>*</hours> 
	<daysofmonth>*</daysofmonth> 
	<months>*</months> 
	<daysofweek>*</daysofweek> 
	<years>*</years> 
	<bussinesdays>true</bussinesdays> 
	<startDate>null</startDate> 
	<endDate>null</endDate> 
	<class>tests.test</class> 
	<method></method> 
	<parameters>1 2 3</parameters>
	<description>null</description> 
</crontabentry>
<crontabentry id="-1">
	<seconds>0</seconds> 
	<minutes>*</minutes> 
	<hours>*</hours> 
	<daysofmonth>*</daysofmonth> 
	<months>*</months> 
	<daysofweek>*</daysofweek> 
	<years>*</years> 
	<bussinesdays>true</bussinesdays> 
	<startDate>null</startDate> 
	<endDate>null</endDate> 
	<class>tests.test</class> 
	<method></method> 
	<parameters>1 2 3</parameters>
	<description>null</description> 
</crontabentry>
<crontabentry id="-1">
	<seconds>0</seconds> 
	<minutes>*</minutes> 
	<hours>*</hours> 
	<daysofmonth>*</daysofmonth> 
	<months>*</months> 
	<daysofweek>*</daysofweek> 
	<years>*</years> 
	<bussinesdays>true</bussinesdays> 
	<startDate>null</startDate> 
	<endDate>null</endDate> 
	<class>tests.test</class> 
	<method></method> 
	<parameters>1 2 3</parameters>
	<description>null</description> 
</crontabentry>
<crontabentry id="-1">
	<seconds>0</seconds> 
	<minutes>*</minutes> 
	<hours>*</hours> 
	<daysofmonth>*</daysofmonth> 
	<months>*</months> 
	<daysofweek>*</daysofweek> 
	<years>*</years> 
	<bussinesdays>true</bussinesdays> 
	<startDate>null</startDate> 
	<endDate>null</endDate> 
	<class>tests.test</class> 
	<method></method> 
	<parameters>1 2 3</parameters>
	<description>null</description> 
</crontabentry>
</crontab>
